Benchmarks/TESTS_TO_RUN/hipcosma.csv
OCCUPANCY,TYPE,VECTORTYPE2,VECTORTYPE4,M,N,K,THREADBLOCK_TILE_M,THREADBLOCK_TILE_N,THREADBLOCK_TILE_K,LOAD_K,WARP_TILE_M,WARP_TILE_N,THREAD_TILE_M,THREAD_TILE_N,SPLIT_K,ALPHA,BETA,SWIZZLE,A_OFFSET,B_OFFSET,ATOMIC_REDUCTION
2,float,float2,float4,2048,2048,2048,128,128,2048,8,64,64,8,8,1,1,0,1,4,0,false
2,float,float2,float4,4096,4096,4096,128,128,4096,8,64,64,8,8,1,1,0,1,4,0,false
2,float,float2,float4,8192,8192,8192,128,128,8192,8,64,64,8,8,1,1,0,1,4,0,false
2,float,float2,float4,16384,16384,16384,128,128,16384,8,64,64,8,8,1,1,0,1,4,0,false
