Benchmarks/TESTS_TO_RUN/LargeN_1-128.csv
OCCUPANCY,TYPE,VECTORTYPE2,VECTORTYPE4,M,N,K,THREADBLOCK_TILE_M,THREADBLOCK_TILE_N,THREADBLOCK_TILE_K,LOAD_K,WARP_TILE_M,WARP_TILE_N,THREAD_TILE_M,THREAD_TILE_N,SPLIT_K,ALPHA,BETA,SWIZZLE,A_OFFSET,B_OFFSET,ATOMIC_REDUCTION,
16,float,float2,float4,1,1,1,32,64,1,1,32,64,8,8,1,1,0,1,4,0,true
16,float,float2,float4,2,4,2,32,64,2,1,32,64,8,8,1,1,0,1,4,0,true
16,float,float2,float4,3,9,3,32,64,3,1,32,64,8,8,1,1,0,1,4,0,true
32,float,float2,float4,4,16,4,16,32,4,2,16,32,4,4,1,1,0,1,4,0,true
32,float,float2,float4,5,25,5,16,32,4,2,16,32,4,4,2,1,0,1,4,0,true
32,float,float2,float4,6,36,6,16,32,4,2,16,32,4,4,2,1,0,1,4,0,true
32,float,float2,float4,7,49,7,16,32,4,2,16,32,4,4,2,1,0,1,4,0,true
39,float,float2,float4,8,64,8,8,16,8,4,8,16,2,2,1,1,0,1,4,0,true
23,float,float2,float4,9,81,9,16,16,8,4,8,16,2,2,2,1,0,1,4,0,true
23,float,float2,float4,10,100,10,16,16,8,4,8,16,2,2,2,1,0,1,4,0,true
23,float,float2,float4,11,121,11,16,16,8,4,8,16,2,2,2,1,0,1,4,0,true
23,float,float2,float4,12,144,12,16,16,8,4,8,16,2,2,2,1,0,1,4,0,true
23,float,float2,float4,13,169,13,16,16,8,4,8,16,2,2,2,1,0,1,4,0,true
23,float,float2,float4,14,196,14,16,16,8,4,8,16,2,2,2,1,0,1,4,0,true
23,float,float2,float4,15,225,15,16,16,8,4,8,16,2,2,2,1,0,1,4,0,true
27,float,float2,float4,16,256,16,8,8,16,8,4,8,1,1,1,1,0,1,4,0,true
27,float,float2,float4,17,289,17,8,8,12,8,4,8,1,1,2,1,0,1,4,0,true
27,float,float2,float4,18,324,18,8,8,18,8,4,8,1,1,1,1,0,1,4,0,true
27,float,float2,float4,19,361,19,8,8,19,8,4,8,1,1,1,1,0,1,4,0,true
27,float,float2,float4,20,400,20,8,8,20,8,4,8,1,1,1,1,0,1,4,0,true
27,float,float2,float4,21,441,21,8,8,21,8,4,8,1,1,1,1,0,1,4,0,true
27,float,float2,float4,22,484,22,8,8,22,8,4,8,1,1,1,1,0,1,4,0,true
27,float,float2,float4,23,529,23,8,8,23,8,4,8,1,1,1,1,0,1,4,0,true
27,float,float2,float4,24,576,24,8,8,24,8,4,8,1,1,1,1,0,1,4,0,true
27,float,float2,float4,25,625,25,8,8,25,8,4,8,1,1,1,1,0,1,4,0,true
27,float,float2,float4,26,676,26,8,8,26,8,4,8,1,1,1,1,0,1,4,0,true
21,float,float2,float4,27,729,27,16,16,12,8,8,16,2,2,3,1,0,1,4,0,true
21,float,float2,float4,28,784,28,16,16,16,8,8,16,2,2,2,1,0,1,4,0,true
21,float,float2,float4,29,841,29,16,16,16,8,8,16,2,2,2,1,0,1,4,0,true
21,float,float2,float4,30,900,30,16,16,16,8,8,16,2,2,2,1,0,1,4,0,true
21,float,float2,float4,31,961,31,16,16,16,8,8,16,2,2,2,1,0,1,4,0,true
21,float,float2,float4,32,1024,32,16,16,16,8,8,16,2,2,2,1,0,1,4,0,true
11,float,float2,float4,33,1089,33,16,32,12,8,8,16,2,2,3,1,0,1,4,0,true
11,float,float2,float4,34,1156,34,16,32,20,8,8,16,2,2,2,1,0,1,4,0,true
21,float,float2,float4,35,1225,35,16,16,35,8,8,16,2,2,1,1,0,1,4,0,true
21,float,float2,float4,36,1296,36,16,16,36,8,8,16,2,2,1,1,0,1,4,0,true
21,float,float2,float4,37,1369,37,16,16,37,8,8,16,2,2,1,1,0,1,4,0,true
21,float,float2,float4,38,1444,38,16,16,38,8,8,16,2,2,1,1,0,1,4,0,true
11,float,float2,float4,39,1521,39,16,32,20,8,8,16,2,2,2,1,0,1,4,0,true
11,float,float2,float4,40,1600,40,16,32,20,8,8,16,2,2,2,1,0,1,4,0,true
21,float,float2,float4,41,1681,41,16,16,41,8,8,16,2,2,1,1,0,1,4,0,true
11,float,float2,float4,42,1764,42,16,32,42,8,8,16,2,2,1,1,0,1,4,0,true
11,float,float2,float4,43,1849,43,16,32,43,8,8,16,2,2,1,1,0,1,4,0,true
11,float,float2,float4,44,1936,44,16,32,44,8,8,16,2,2,1,1,0,1,4,0,true
11,float,float2,float4,45,2025,45,16,32,45,8,8,16,2,2,1,1,0,1,4,0,true
11,float,float2,float4,46,2116,46,16,32,46,8,8,16,2,2,1,1,0,1,4,0,true
11,float,float2,float4,47,2209,47,16,32,47,8,8,16,2,2,1,1,0,1,4,0,true
11,float,float2,float4,48,2304,48,16,32,48,8,8,16,2,2,1,1,0,1,4,0,true
12,float,float2,float4,49,2401,49,32,32,28,8,16,32,4,4,2,1,0,1,4,0,true
12,float,float2,float4,50,2500,50,32,32,28,8,16,32,4,4,2,1,0,1,4,0,true
5,float,float2,float4,51,2601,51,32,32,51,8,8,16,2,2,1,1,0,1,4,0,true
5,float,float2,float4,52,2704,52,32,32,52,8,8,16,2,2,1,1,0,1,4,0,true
5,float,float2,float4,53,2809,53,32,32,53,8,8,16,2,2,1,1,0,1,4,0,true
5,float,float2,float4,54,2916,54,32,32,54,8,8,16,2,2,1,1,0,1,4,0,true
12,float,float2,float4,55,3025,55,32,32,55,8,16,32,4,4,1,1,0,1,4,0,true
12,float,float2,float4,56,3136,56,32,32,56,8,16,32,4,4,1,1,0,1,4,0,true
12,float,float2,float4,57,3249,57,32,32,57,8,16,32,4,4,1,1,0,1,4,0,true
12,float,float2,float4,58,3364,58,32,32,58,8,16,32,4,4,1,1,0,1,4,0,true
12,float,float2,float4,59,3481,59,32,32,59,8,16,32,4,4,1,1,0,1,4,0,true
12,float,float2,float4,60,3600,60,32,32,60,8,16,32,4,4,1,1,0,1,4,0,true
12,float,float2,float4,61,3721,61,32,32,61,8,16,32,4,4,1,1,0,1,4,0,true
12,float,float2,float4,62,3844,62,32,32,62,8,16,32,4,4,1,1,0,1,4,0,true
12,float,float2,float4,63,3969,63,32,32,63,8,16,32,4,4,1,1,0,1,4,0,true
8,float,float2,float4,64,4096,64,32,64,32,8,32,16,4,4,2,1,0,1,4,0,true
4,float,float2,float4,65,4225,65,32,128,36,8,16,32,4,4,2,1,0,1,4,0,true
4,float,float2,float4,66,4356,66,32,128,36,8,16,32,4,4,2,1,0,1,4,0,true
4,float,float2,float4,67,4489,67,32,128,36,8,16,32,4,4,2,1,0,1,4,0,true
8,float,float2,float4,68,4624,68,32,64,68,8,16,32,4,4,1,1,0,1,4,0,true
8,float,float2,float4,69,4761,69,32,64,69,8,16,32,4,4,1,1,0,1,4,0,true
8,float,float2,float4,70,4900,70,32,64,70,8,16,32,4,4,1,1,0,1,4,0,true
8,float,float2,float4,71,5041,71,32,64,71,8,16,32,4,4,1,1,0,1,4,0,true
8,float,float2,float4,72,5184,72,32,64,72,8,16,32,4,4,1,1,0,1,4,0,true
8,float,float2,float4,73,5329,73,32,64,73,8,16,32,4,4,1,1,0,1,4,0,true
8,float,float2,float4,74,5476,74,32,64,74,8,16,32,4,4,1,1,0,1,4,0,true
8,float,float2,float4,75,5625,75,32,64,75,8,16,32,4,4,1,1,0,1,4,0,true
8,float,float2,float4,76,5776,76,32,64,76,8,16,32,4,4,1,1,0,1,4,0,true
4,float,float2,float4,77,5929,77,64,64,77,8,16,32,4,4,1,1,0,1,4,0,true
4,float,float2,float4,78,6084,78,64,64,78,8,16,32,4,4,1,1,0,1,4,0,true
4,float,float2,float4,79,6241,79,64,64,79,8,16,32,4,4,1,1,0,1,4,0,true
4,float,float2,float4,80,6400,80,64,64,80,8,16,32,4,4,1,1,0,1,4,0,true
4,float,float2,float4,81,6561,81,64,64,81,8,16,32,4,4,1,1,0,1,4,0,true
4,float,float2,float4,82,6724,82,64,64,82,8,16,32,4,4,1,1,0,1,4,0,true
4,float,float2,float4,83,6889,83,32,128,83,8,16,32,4,4,1,1,0,1,4,0,true
4,float,float2,float4,84,7056,84,32,128,84,8,16,32,4,4,1,1,0,1,4,0,true
4,float,float2,float4,85,7225,85,32,128,85,8,16,32,4,4,1,1,0,1,4,0,true
4,float,float2,float4,86,7396,86,32,128,86,8,16,32,4,4,1,1,0,1,4,0,true
5,float,float2,float4,87,7569,87,32,128,87,8,32,64,8,8,1,1,0,1,4,0,true
5,float,float2,float4,88,7744,88,32,128,88,8,32,64,8,8,1,1,0,1,4,0,true
5,float,float2,float4,89,7921,89,32,128,89,8,32,64,8,8,1,1,0,1,4,0,true
5,float,float2,float4,90,8100,90,32,128,90,8,32,64,8,8,1,1,0,1,4,0,true
5,float,float2,float4,91,8281,91,32,128,91,8,32,64,8,8,1,1,0,1,4,0,true
5,float,float2,float4,92,8464,92,32,128,92,8,32,64,8,8,1,1,0,1,4,0,true
5,float,float2,float4,93,8649,93,32,128,93,8,32,64,8,8,1,1,0,1,4,0,true
5,float,float2,float4,94,8836,94,32,128,94,8,32,64,8,8,1,1,0,1,4,0,true
5,float,float2,float4,95,9025,95,32,128,95,8,32,64,8,8,1,1,0,1,4,0,true
5,float,float2,float4,96,9216,96,32,128,96,8,32,64,8,8,1,1,0,1,4,0,true
7,float,float2,float4,97,9409,97,64,64,97,8,32,64,8,8,1,1,0,1,4,0,true
7,float,float2,float4,98,9604,98,64,64,98,8,32,64,8,8,1,1,0,1,4,0,true
7,float,float2,float4,99,9801,99,64,64,99,8,32,64,8,8,1,1,0,1,4,0,true
7,float,float2,float4,100,10000,100,64,64,100,8,32,64,8,8,1,1,0,1,4,0,true
2,float,float2,float4,101,10201,101,64,128,101,8,16,32,4,4,1,1,0,1,4,0,true
4,float,float2,float4,102,10404,102,128,64,102,8,32,64,8,8,1,1,0,1,4,0,true
4,float,float2,float4,103,10609,103,64,128,103,8,32,64,8,8,1,1,0,1,4,0,true
4,float,float2,float4,104,10816,104,128,64,104,8,32,64,8,8,1,1,0,1,4,0,true
4,float,float2,float4,105,11025,105,128,64,105,8,32,64,8,8,1,1,0,1,4,0,true
4,float,float2,float4,106,11236,106,64,128,106,8,32,64,8,8,1,1,0,1,4,0,true
4,float,float2,float4,107,11449,107,128,64,107,8,32,64,8,8,1,1,0,1,4,0,true
4,float,float2,float4,108,11664,108,128,64,108,8,32,64,8,8,1,1,0,1,4,0,true
4,float,float2,float4,109,11881,109,64,128,109,8,32,64,8,8,1,1,0,1,4,0,true
4,float,float2,float4,110,12100,110,64,128,110,8,32,64,8,8,1,1,0,1,4,0,true
4,float,float2,float4,111,12321,111,128,64,111,8,32,64,8,8,1,1,0,1,4,0,true
4,float,float2,float4,112,12544,112,64,128,112,8,32,64,8,8,1,1,0,1,4,0,true
4,float,float2,float4,113,12769,113,64,128,113,8,32,64,8,8,1,1,0,1,4,0,true
4,float,float2,float4,114,12996,114,64,128,114,8,32,64,8,8,1,1,0,1,4,0,true
4,float,float2,float4,115,13225,115,128,64,115,8,32,64,8,8,1,1,0,1,4,0,true
4,float,float2,float4,116,13456,116,128,64,116,8,32,64,8,8,1,1,0,1,4,0,true
4,float,float2,float4,117,13689,117,64,128,117,8,32,64,8,8,1,1,0,1,4,0,true
4,float,float2,float4,118,13924,118,64,128,118,8,32,64,8,8,1,1,0,1,4,0,true
4,float,float2,float4,119,14161,119,64,128,119,8,32,64,8,8,1,1,0,1,4,0,true
4,float,float2,float4,120,14400,120,128,64,120,8,32,64,8,8,1,1,0,1,4,0,true
4,float,float2,float4,121,14641,121,128,64,121,8,32,64,8,8,1,1,0,1,4,0,true
4,float,float2,float4,122,14884,122,128,64,122,8,32,64,8,8,1,1,0,1,4,0,true
4,float,float2,float4,123,15129,123,128,64,123,8,32,64,8,8,1,1,0,1,4,0,true
4,float,float2,float4,124,15376,124,128,64,124,8,32,64,8,8,1,1,0,1,4,0,true
4,float,float2,float4,125,15625,125,128,64,125,8,32,64,8,8,1,1,0,1,4,0,true
4,float,float2,float4,126,15876,126,128,64,126,8,32,64,8,8,1,1,0,1,4,0,true
4,float,float2,float4,127,16129,127,128,64,127,8,32,64,8,8,1,1,0,1,4,0,true
4,float,float2,float4,128,16384,128,64,128,128,8,32,64,8,8,1,1,0,1,4,0,true
