Benchmarks/TESTS_TO_RUN/special.csv
OCCUPANCY,TYPE,VECTORTYPE2,VECTORTYPE4,M,N,K,THREADBLOCK_TILE_M,THREADBLOCK_TILE_N,THREADBLOCK_TILE_K,LOAD_K,WARP_TILE_M,WARP_TILE_N,THREAD_TILE_M,THREAD_TILE_N,SPLIT_K,ALPHA,BETA,SWIZZLE,A_OFFSET,B_OFFSET,ATOMIC_REDUCTION
2,float,float2,float4,128,128,128,16,32,32,8,8,16,2,2,4,1,0,1,4,0,false
2,float,float2,float4,128,128,128,16,32,32,8,8,16,2,2,4,1,0,1,4,0,true
2,float,float2,float4,4,8,3000000,4,8,9375,8,4,8,1,1,320,1,0,1,4,0,true
2,float,float2,float4,4,8,3000000,4,8,9375,8,4,8,1,1,320,1,0,1,4,0,false
2,float,float2,float4,4,3000000,4,4,256,4,2,4,256,4,8,1,1,0,1,4,0,false
2,float,float2,float4,38416,38416,4,128,128,4,2,32,64,8,8,1,1,0,1,4,0,false
