Benchmarks/TESTS_TO_RUN/square_1-512.csv
OCCUPANCY,TYPE,VECTORTYPE2,VECTORTYPE4,M,N,K,THREADBLOCK_TILE_M,THREADBLOCK_TILE_N,THREADBLOCK_TILE_K,LOAD_K,WARP_TILE_M,WARP_TILE_N,THREAD_TILE_M,THREAD_TILE_N,SPLIT_K,ALPHA,BETA,SWIZZLE,A_OFFSET,B_OFFSET,ATOMIC_REDUCTION,
16,float,float2,float4,1,1,1,32,64,1,1,32,64,8,8,1,1,0,1,4,0,true
16,float,float2,float4,2,2,2,32,64,2,1,32,64,8,8,1,1,0,1,4,0,true
16,float,float2,float4,3,3,3,32,64,3,1,32,64,8,8,1,1,0,1,4,0,true
32,float,float2,float4,4,4,4,16,32,4,2,16,32,4,4,1,1,0,1,4,0,true
32,float,float2,float4,5,5,5,16,32,4,2,16,32,4,4,2,1,0,1,4,0,true
32,float,float2,float4,6,6,6,16,32,4,2,16,32,4,4,2,1,0,1,4,0,true
32,float,float2,float4,7,7,7,16,32,4,2,16,32,4,4,2,1,0,1,4,0,true
39,float,float2,float4,8,8,8,8,16,8,4,8,16,2,2,1,1,0,1,4,0,true
23,float,float2,float4,9,9,9,16,16,8,4,8,16,2,2,2,1,0,1,4,0,true
23,float,float2,float4,10,10,10,16,16,8,4,8,16,2,2,2,1,0,1,4,0,true
23,float,float2,float4,11,11,11,16,16,8,4,8,16,2,2,2,1,0,1,4,0,true
23,float,float2,float4,12,12,12,16,16,8,4,8,16,2,2,2,1,0,1,4,0,true
23,float,float2,float4,13,13,13,16,16,8,4,8,16,2,2,2,1,0,1,4,0,true
23,float,float2,float4,14,14,14,16,16,8,4,8,16,2,2,2,1,0,1,4,0,true
23,float,float2,float4,15,15,15,16,16,8,4,8,16,2,2,2,1,0,1,4,0,true
27,float,float2,float4,16,16,16,8,8,16,8,4,8,1,1,1,1,0,1,4,0,true
27,float,float2,float4,17,17,17,8,8,12,8,4,8,1,1,2,1,0,1,4,0,true
27,float,float2,float4,18,18,18,8,8,12,8,4,8,1,1,2,1,0,1,4,0,true
27,float,float2,float4,19,19,19,8,8,12,8,4,8,1,1,2,1,0,1,4,0,true
27,float,float2,float4,20,20,20,8,8,12,8,4,8,1,1,2,1,0,1,4,0,true
27,float,float2,float4,21,21,21,8,8,12,8,4,8,1,1,2,1,0,1,4,0,true
27,float,float2,float4,22,22,22,8,8,12,8,4,8,1,1,2,1,0,1,4,0,true
27,float,float2,float4,23,23,23,8,8,12,8,4,8,1,1,2,1,0,1,4,0,true
27,float,float2,float4,24,24,24,8,8,12,8,4,8,1,1,2,1,0,1,4,0,true
27,float,float2,float4,25,25,25,8,8,12,8,4,8,1,1,3,1,0,1,4,0,true
27,float,float2,float4,26,26,26,8,8,12,8,4,8,1,1,3,1,0,1,4,0,true
27,float,float2,float4,27,27,27,8,8,12,8,4,8,1,1,3,1,0,1,4,0,true
27,float,float2,float4,28,28,28,8,8,12,8,4,8,1,1,3,1,0,1,4,0,true
27,float,float2,float4,29,29,29,8,8,12,8,4,8,1,1,3,1,0,1,4,0,true
27,float,float2,float4,30,30,30,8,8,12,8,4,8,1,1,3,1,0,1,4,0,true
27,float,float2,float4,31,31,31,8,8,12,8,4,8,1,1,3,1,0,1,4,0,true
27,float,float2,float4,32,32,32,8,8,12,8,4,8,1,1,3,1,0,1,4,0,true
27,float,float2,float4,33,33,33,8,8,12,8,4,8,1,1,3,1,0,1,4,0,true
27,float,float2,float4,34,34,34,8,8,12,8,4,8,1,1,3,1,0,1,4,0,true
27,float,float2,float4,35,35,35,8,8,12,8,4,8,1,1,3,1,0,1,4,0,true
27,float,float2,float4,36,36,36,8,8,12,8,4,8,1,1,3,1,0,1,4,0,true
27,float,float2,float4,37,37,37,8,8,12,8,4,8,1,1,4,1,0,1,4,0,true
27,float,float2,float4,38,38,38,8,8,12,8,4,8,1,1,4,1,0,1,4,0,true
27,float,float2,float4,39,39,39,8,8,12,8,4,8,1,1,4,1,0,1,4,0,true
27,float,float2,float4,40,40,40,8,8,12,8,4,8,1,1,4,1,0,1,4,0,true
27,float,float2,float4,41,41,41,8,8,12,8,4,8,1,1,4,1,0,1,4,0,true
27,float,float2,float4,42,42,42,8,8,12,8,4,8,1,1,4,1,0,1,4,0,true
27,float,float2,float4,43,43,43,8,8,12,8,4,8,1,1,4,1,0,1,4,0,true
27,float,float2,float4,44,44,44,8,8,12,8,4,8,1,1,4,1,0,1,4,0,true
27,float,float2,float4,45,45,45,8,8,12,8,4,8,1,1,4,1,0,1,4,0,true
27,float,float2,float4,46,46,46,8,8,12,8,4,8,1,1,4,1,0,1,4,0,true
27,float,float2,float4,47,47,47,8,8,12,8,4,8,1,1,4,1,0,1,4,0,true
27,float,float2,float4,48,48,48,8,8,12,8,4,8,1,1,4,1,0,1,4,0,true
27,float,float2,float4,49,49,49,8,8,12,8,4,8,1,1,5,1,0,1,4,0,true
27,float,float2,float4,50,50,50,8,8,12,8,4,8,1,1,5,1,0,1,4,0,true
27,float,float2,float4,51,51,51,8,8,20,8,4,8,1,1,3,1,0,1,4,0,true
27,float,float2,float4,52,52,52,8,8,20,8,4,8,1,1,3,1,0,1,4,0,true
27,float,float2,float4,53,53,53,8,8,20,8,4,8,1,1,3,1,0,1,4,0,true
27,float,float2,float4,54,54,54,8,8,20,8,4,8,1,1,3,1,0,1,4,0,true
27,float,float2,float4,55,55,55,8,8,20,8,4,8,1,1,3,1,0,1,4,0,true
27,float,float2,float4,56,56,56,8,8,20,8,4,8,1,1,3,1,0,1,4,0,true
27,float,float2,float4,57,57,57,8,8,20,8,4,8,1,1,3,1,0,1,4,0,true
27,float,float2,float4,58,58,58,8,8,20,8,4,8,1,1,3,1,0,1,4,0,true
27,float,float2,float4,59,59,59,8,8,20,8,4,8,1,1,3,1,0,1,4,0,true
27,float,float2,float4,60,60,60,8,8,20,8,4,8,1,1,3,1,0,1,4,0,true
27,float,float2,float4,61,61,61,8,8,32,8,4,8,1,1,2,1,0,1,4,0,true
27,float,float2,float4,62,62,62,8,8,32,8,4,8,1,1,2,1,0,1,4,0,true
27,float,float2,float4,63,63,63,8,8,32,8,4,8,1,1,2,1,0,1,4,0,true
27,float,float2,float4,64,64,64,8,8,32,8,4,8,1,1,2,1,0,1,4,0,true
27,float,float2,float4,65,65,65,8,8,36,8,4,8,1,1,2,1,0,1,4,0,true
27,float,float2,float4,66,66,66,8,8,36,8,4,8,1,1,2,1,0,1,4,0,true
27,float,float2,float4,67,67,67,8,8,36,8,4,8,1,1,2,1,0,1,4,0,true
27,float,float2,float4,68,68,68,8,8,36,8,4,8,1,1,2,1,0,1,4,0,true
27,float,float2,float4,69,69,69,8,8,36,8,4,8,1,1,2,1,0,1,4,0,true
27,float,float2,float4,70,70,70,8,8,36,8,4,8,1,1,2,1,0,1,4,0,true
27,float,float2,float4,71,71,71,8,8,36,8,4,8,1,1,2,1,0,1,4,0,true
21,float,float2,float4,72,72,72,16,16,12,8,8,16,2,2,6,1,0,1,4,0,true
21,float,float2,float4,73,73,73,16,16,12,8,8,16,2,2,7,1,0,1,4,0,true
21,float,float2,float4,74,74,74,16,16,12,8,8,16,2,2,7,1,0,1,4,0,true
21,float,float2,float4,75,75,75,16,16,12,8,8,16,2,2,7,1,0,1,4,0,true
21,float,float2,float4,76,76,76,16,16,12,8,8,16,2,2,7,1,0,1,4,0,true
21,float,float2,float4,77,77,77,16,16,16,8,8,16,2,2,5,1,0,1,4,0,true
21,float,float2,float4,78,78,78,16,16,16,8,8,16,2,2,5,1,0,1,4,0,true
21,float,float2,float4,79,79,79,16,16,16,8,8,16,2,2,5,1,0,1,4,0,true
21,float,float2,float4,80,80,80,16,16,16,8,8,16,2,2,5,1,0,1,4,0,true
21,float,float2,float4,81,81,81,16,16,12,8,8,16,2,2,7,1,0,1,4,0,true
21,float,float2,float4,82,82,82,16,16,12,8,8,16,2,2,7,1,0,1,4,0,true
21,float,float2,float4,83,83,83,16,16,12,8,8,16,2,2,7,1,0,1,4,0,true
21,float,float2,float4,84,84,84,16,16,12,8,8,16,2,2,7,1,0,1,4,0,true
21,float,float2,float4,85,85,85,16,16,16,8,8,16,2,2,6,1,0,1,4,0,true
21,float,float2,float4,86,86,86,16,16,16,8,8,16,2,2,6,1,0,1,4,0,true
21,float,float2,float4,87,87,87,16,16,16,8,8,16,2,2,6,1,0,1,4,0,true
21,float,float2,float4,88,88,88,16,16,16,8,8,16,2,2,6,1,0,1,4,0,true
21,float,float2,float4,89,89,89,16,16,16,8,8,16,2,2,6,1,0,1,4,0,true
21,float,float2,float4,90,90,90,16,16,16,8,8,16,2,2,6,1,0,1,4,0,true
11,float,float2,float4,91,91,91,16,32,12,8,8,16,2,2,8,1,0,1,4,0,true
11,float,float2,float4,92,92,92,16,32,12,8,8,16,2,2,8,1,0,1,4,0,true
11,float,float2,float4,93,93,93,16,32,12,8,8,16,2,2,8,1,0,1,4,0,true
11,float,float2,float4,94,94,94,16,32,12,8,8,16,2,2,8,1,0,1,4,0,true
21,float,float2,float4,95,95,95,16,16,24,8,8,16,2,2,4,1,0,1,4,0,true
21,float,float2,float4,96,96,96,16,16,24,8,8,16,2,2,4,1,0,1,4,0,true
21,float,float2,float4,97,97,97,16,16,20,8,8,16,2,2,5,1,0,1,4,0,true
21,float,float2,float4,98,98,98,16,16,20,8,8,16,2,2,5,1,0,1,4,0,true
21,float,float2,float4,99,99,99,16,16,20,8,8,16,2,2,5,1,0,1,4,0,true
21,float,float2,float4,100,100,100,16,16,20,8,8,16,2,2,5,1,0,1,4,0,true
21,float,float2,float4,101,101,101,16,16,28,8,8,16,2,2,4,1,0,1,4,0,true
21,float,float2,float4,102,102,102,16,16,28,8,8,16,2,2,4,1,0,1,4,0,true
21,float,float2,float4,103,103,103,16,16,28,8,8,16,2,2,4,1,0,1,4,0,true
21,float,float2,float4,104,104,104,16,16,28,8,8,16,2,2,4,1,0,1,4,0,true
21,float,float2,float4,105,105,105,16,16,28,8,8,16,2,2,4,1,0,1,4,0,true
21,float,float2,float4,106,106,106,16,16,28,8,8,16,2,2,4,1,0,1,4,0,true
21,float,float2,float4,107,107,107,16,16,28,8,8,16,2,2,4,1,0,1,4,0,true
21,float,float2,float4,108,108,108,16,16,28,8,8,16,2,2,4,1,0,1,4,0,true
21,float,float2,float4,109,109,109,16,16,28,8,8,16,2,2,4,1,0,1,4,0,true
21,float,float2,float4,110,110,110,16,16,28,8,8,16,2,2,4,1,0,1,4,0,true
21,float,float2,float4,111,111,111,16,16,28,8,8,16,2,2,4,1,0,1,4,0,true
21,float,float2,float4,112,112,112,16,16,28,8,8,16,2,2,4,1,0,1,4,0,true
11,float,float2,float4,113,113,113,16,32,20,8,8,16,2,2,6,1,0,1,4,0,true
11,float,float2,float4,114,114,114,16,32,20,8,8,16,2,2,6,1,0,1,4,0,true
11,float,float2,float4,115,115,115,16,32,20,8,8,16,2,2,6,1,0,1,4,0,true
11,float,float2,float4,116,116,116,16,32,20,8,8,16,2,2,6,1,0,1,4,0,true
11,float,float2,float4,117,117,117,16,32,20,8,8,16,2,2,6,1,0,1,4,0,true
11,float,float2,float4,118,118,118,16,32,20,8,8,16,2,2,6,1,0,1,4,0,true
11,float,float2,float4,119,119,119,16,32,20,8,8,16,2,2,6,1,0,1,4,0,true
11,float,float2,float4,120,120,120,16,32,20,8,8,16,2,2,6,1,0,1,4,0,true
11,float,float2,float4,121,121,121,16,32,28,8,8,16,2,2,5,1,0,1,4,0,true
11,float,float2,float4,122,122,122,16,32,28,8,8,16,2,2,5,1,0,1,4,0,true
11,float,float2,float4,123,123,123,16,32,28,8,8,16,2,2,5,1,0,1,4,0,true
11,float,float2,float4,124,124,124,16,32,28,8,8,16,2,2,5,1,0,1,4,0,true
11,float,float2,float4,125,125,125,16,32,28,8,8,16,2,2,5,1,0,1,4,0,true
11,float,float2,float4,126,126,126,16,32,28,8,8,16,2,2,5,1,0,1,4,0,true
11,float,float2,float4,127,127,127,16,32,28,8,8,16,2,2,5,1,0,1,4,0,true
11,float,float2,float4,128,128,128,16,32,28,8,8,16,2,2,5,1,0,1,4,0,true
21,float,float2,float4,129,129,129,16,16,44,8,8,16,2,2,3,1,0,1,4,0,true
21,float,float2,float4,130,130,130,16,16,44,8,8,16,2,2,3,1,0,1,4,0,true
21,float,float2,float4,131,131,131,16,16,44,8,8,16,2,2,3,1,0,1,4,0,true
21,float,float2,float4,132,132,132,16,16,44,8,8,16,2,2,3,1,0,1,4,0,true
11,float,float2,float4,133,133,133,16,32,28,8,8,16,2,2,5,1,0,1,4,0,true
11,float,float2,float4,134,134,134,16,32,28,8,8,16,2,2,5,1,0,1,4,0,true
11,float,float2,float4,135,135,135,16,32,36,8,8,16,2,2,4,1,0,1,4,0,true
11,float,float2,float4,136,136,136,16,32,36,8,8,16,2,2,4,1,0,1,4,0,true
11,float,float2,float4,137,137,137,16,32,36,8,8,16,2,2,4,1,0,1,4,0,true
11,float,float2,float4,138,138,138,16,32,36,8,8,16,2,2,4,1,0,1,4,0,true
11,float,float2,float4,139,139,139,16,32,36,8,8,16,2,2,4,1,0,1,4,0,true
11,float,float2,float4,140,140,140,16,32,36,8,8,16,2,2,4,1,0,1,4,0,true
11,float,float2,float4,141,141,141,16,32,36,8,8,16,2,2,4,1,0,1,4,0,true
11,float,float2,float4,142,142,142,16,32,36,8,8,16,2,2,4,1,0,1,4,0,true
11,float,float2,float4,143,143,143,16,32,36,8,8,16,2,2,4,1,0,1,4,0,true
11,float,float2,float4,144,144,144,16,32,36,8,8,16,2,2,4,1,0,1,4,0,true
5,float,float2,float4,145,145,145,32,32,24,8,8,16,2,2,7,1,0,1,4,0,true
5,float,float2,float4,146,146,146,32,32,24,8,8,16,2,2,7,1,0,1,4,0,true
5,float,float2,float4,147,147,147,32,32,24,8,8,16,2,2,7,1,0,1,4,0,true
5,float,float2,float4,148,148,148,32,32,24,8,8,16,2,2,7,1,0,1,4,0,true
5,float,float2,float4,149,149,149,32,32,24,8,8,16,2,2,7,1,0,1,4,0,true
5,float,float2,float4,150,150,150,32,32,24,8,8,16,2,2,7,1,0,1,4,0,true
5,float,float2,float4,151,151,151,32,32,24,8,8,16,2,2,7,1,0,1,4,0,true
5,float,float2,float4,152,152,152,32,32,24,8,8,16,2,2,7,1,0,1,4,0,true
12,float,float2,float4,153,153,153,32,32,24,8,16,32,4,4,7,1,0,1,4,0,true
12,float,float2,float4,154,154,154,32,32,24,8,16,32,4,4,7,1,0,1,4,0,true
12,float,float2,float4,155,155,155,32,32,24,8,16,32,4,4,7,1,0,1,4,0,true
12,float,float2,float4,156,156,156,32,32,24,8,16,32,4,4,7,1,0,1,4,0,true
12,float,float2,float4,157,157,157,32,32,24,8,16,32,4,4,7,1,0,1,4,0,true
12,float,float2,float4,158,158,158,32,32,24,8,16,32,4,4,7,1,0,1,4,0,true
12,float,float2,float4,159,159,159,32,32,24,8,16,32,4,4,7,1,0,1,4,0,true
12,float,float2,float4,160,160,160,32,32,24,8,16,32,4,4,7,1,0,1,4,0,true
5,float,float2,float4,161,161,161,32,32,28,8,8,16,2,2,6,1,0,1,4,0,true
5,float,float2,float4,162,162,162,32,32,28,8,8,16,2,2,6,1,0,1,4,0,true
5,float,float2,float4,163,163,163,32,32,28,8,8,16,2,2,6,1,0,1,4,0,true
5,float,float2,float4,164,164,164,32,32,28,8,8,16,2,2,6,1,0,1,4,0,true
5,float,float2,float4,165,165,165,32,32,36,8,8,16,2,2,5,1,0,1,4,0,true
5,float,float2,float4,166,166,166,32,32,36,8,8,16,2,2,5,1,0,1,4,0,true
5,float,float2,float4,167,167,167,32,32,36,8,8,16,2,2,5,1,0,1,4,0,true
5,float,float2,float4,168,168,168,32,32,36,8,8,16,2,2,5,1,0,1,4,0,true
5,float,float2,float4,169,169,169,32,32,36,8,8,16,2,2,5,1,0,1,4,0,true
5,float,float2,float4,170,170,170,32,32,36,8,8,16,2,2,5,1,0,1,4,0,true
5,float,float2,float4,171,171,171,32,32,36,8,8,16,2,2,5,1,0,1,4,0,true
5,float,float2,float4,172,172,172,32,32,36,8,8,16,2,2,5,1,0,1,4,0,true
5,float,float2,float4,173,173,173,32,32,36,8,8,16,2,2,5,1,0,1,4,0,true
5,float,float2,float4,174,174,174,32,32,36,8,8,16,2,2,5,1,0,1,4,0,true
5,float,float2,float4,175,175,175,32,32,36,8,8,16,2,2,5,1,0,1,4,0,true
5,float,float2,float4,176,176,176,32,32,36,8,8,16,2,2,5,1,0,1,4,0,true
5,float,float2,float4,177,177,177,32,32,36,8,8,16,2,2,5,1,0,1,4,0,true
5,float,float2,float4,178,178,178,32,32,36,8,8,16,2,2,5,1,0,1,4,0,true
5,float,float2,float4,179,179,179,32,32,36,8,8,16,2,2,5,1,0,1,4,0,true
5,float,float2,float4,180,180,180,32,32,36,8,8,16,2,2,5,1,0,1,4,0,true
12,float,float2,float4,181,181,181,32,32,40,8,16,32,4,4,5,1,0,1,4,0,true
12,float,float2,float4,182,182,182,32,32,40,8,16,32,4,4,5,1,0,1,4,0,true
12,float,float2,float4,183,183,183,32,32,40,8,16,32,4,4,5,1,0,1,4,0,true
12,float,float2,float4,184,184,184,32,32,40,8,16,32,4,4,5,1,0,1,4,0,true
12,float,float2,float4,185,185,185,32,32,40,8,16,32,4,4,5,1,0,1,4,0,true
12,float,float2,float4,186,186,186,32,32,40,8,16,32,4,4,5,1,0,1,4,0,true
12,float,float2,float4,187,187,187,32,32,40,8,16,32,4,4,5,1,0,1,4,0,true
12,float,float2,float4,188,188,188,32,32,40,8,16,32,4,4,5,1,0,1,4,0,true
12,float,float2,float4,189,189,189,32,32,40,8,16,32,4,4,5,1,0,1,4,0,true
12,float,float2,float4,190,190,190,32,32,40,8,16,32,4,4,5,1,0,1,4,0,true
12,float,float2,float4,191,191,191,32,32,40,8,16,32,4,4,5,1,0,1,4,0,true
12,float,float2,float4,192,192,192,32,32,40,8,16,32,4,4,5,1,0,1,4,0,true
12,float,float2,float4,193,193,193,32,32,40,8,16,32,4,4,5,1,0,1,4,0,true
12,float,float2,float4,194,194,194,32,32,40,8,16,32,4,4,5,1,0,1,4,0,true
5,float,float2,float4,195,195,195,32,32,52,8,8,16,2,2,4,1,0,1,4,0,true
5,float,float2,float4,196,196,196,32,32,52,8,8,16,2,2,4,1,0,1,4,0,true
5,float,float2,float4,197,197,197,32,32,52,8,8,16,2,2,4,1,0,1,4,0,true
5,float,float2,float4,198,198,198,32,32,52,8,8,16,2,2,4,1,0,1,4,0,true
5,float,float2,float4,199,199,199,32,32,52,8,8,16,2,2,4,1,0,1,4,0,true
5,float,float2,float4,200,200,200,32,32,52,8,8,16,2,2,4,1,0,1,4,0,true
12,float,float2,float4,201,201,201,32,32,52,8,16,32,4,4,4,1,0,1,4,0,true
12,float,float2,float4,202,202,202,32,32,52,8,16,32,4,4,4,1,0,1,4,0,true
12,float,float2,float4,203,203,203,32,32,52,8,16,32,4,4,4,1,0,1,4,0,true
12,float,float2,float4,204,204,204,32,32,52,8,16,32,4,4,4,1,0,1,4,0,true
12,float,float2,float4,205,205,205,32,32,52,8,16,32,4,4,4,1,0,1,4,0,true
12,float,float2,float4,206,206,206,32,32,52,8,16,32,4,4,4,1,0,1,4,0,true
12,float,float2,float4,207,207,207,32,32,52,8,16,32,4,4,4,1,0,1,4,0,true
12,float,float2,float4,208,208,208,32,32,52,8,16,32,4,4,4,1,0,1,4,0,true
12,float,float2,float4,209,209,209,32,32,56,8,16,32,4,4,4,1,0,1,4,0,true
12,float,float2,float4,210,210,210,32,32,56,8,16,32,4,4,4,1,0,1,4,0,true
12,float,float2,float4,211,211,211,32,32,56,8,16,32,4,4,4,1,0,1,4,0,true
12,float,float2,float4,212,212,212,32,32,56,8,16,32,4,4,4,1,0,1,4,0,true
12,float,float2,float4,213,213,213,32,32,56,8,16,32,4,4,4,1,0,1,4,0,true
12,float,float2,float4,214,214,214,32,32,56,8,16,32,4,4,4,1,0,1,4,0,true
12,float,float2,float4,215,215,215,32,32,56,8,16,32,4,4,4,1,0,1,4,0,true
12,float,float2,float4,216,216,216,32,32,56,8,16,32,4,4,4,1,0,1,4,0,true
12,float,float2,float4,217,217,217,32,32,56,8,16,32,4,4,4,1,0,1,4,0,true
12,float,float2,float4,218,218,218,32,32,56,8,16,32,4,4,4,1,0,1,4,0,true
12,float,float2,float4,219,219,219,32,32,56,8,16,32,4,4,4,1,0,1,4,0,true
12,float,float2,float4,220,220,220,32,32,56,8,16,32,4,4,4,1,0,1,4,0,true
12,float,float2,float4,221,221,221,32,32,56,8,16,32,4,4,4,1,0,1,4,0,true
12,float,float2,float4,222,222,222,32,32,56,8,16,32,4,4,4,1,0,1,4,0,true
12,float,float2,float4,223,223,223,32,32,56,8,16,32,4,4,4,1,0,1,4,0,true
12,float,float2,float4,224,224,224,32,32,56,8,16,32,4,4,4,1,0,1,4,0,true
8,float,float2,float4,225,225,225,32,64,40,8,16,32,4,4,6,1,0,1,4,0,true
8,float,float2,float4,226,226,226,32,64,40,8,16,32,4,4,6,1,0,1,4,0,true
8,float,float2,float4,227,227,227,32,64,40,8,16,32,4,4,6,1,0,1,4,0,true
8,float,float2,float4,228,228,228,32,64,40,8,16,32,4,4,6,1,0,1,4,0,true
8,float,float2,float4,229,229,229,32,64,40,8,16,32,4,4,6,1,0,1,4,0,true
8,float,float2,float4,230,230,230,32,64,40,8,16,32,4,4,6,1,0,1,4,0,true
8,float,float2,float4,231,231,231,32,64,40,8,16,32,4,4,6,1,0,1,4,0,true
8,float,float2,float4,232,232,232,32,64,40,8,16,32,4,4,6,1,0,1,4,0,true
8,float,float2,float4,233,233,233,32,64,40,8,16,32,4,4,6,1,0,1,4,0,true
8,float,float2,float4,234,234,234,32,64,40,8,16,32,4,4,6,1,0,1,4,0,true
8,float,float2,float4,235,235,235,32,64,40,8,16,32,4,4,6,1,0,1,4,0,true
8,float,float2,float4,236,236,236,32,64,40,8,16,32,4,4,6,1,0,1,4,0,true
8,float,float2,float4,237,237,237,32,64,40,8,16,32,4,4,6,1,0,1,4,0,true
8,float,float2,float4,238,238,238,32,64,40,8,16,32,4,4,6,1,0,1,4,0,true
8,float,float2,float4,239,239,239,32,64,40,8,16,32,4,4,6,1,0,1,4,0,true
8,float,float2,float4,240,240,240,32,64,40,8,16,32,4,4,6,1,0,1,4,0,true
8,float,float2,float4,241,241,241,32,64,52,8,16,32,4,4,5,1,0,1,4,0,true
8,float,float2,float4,242,242,242,32,64,52,8,16,32,4,4,5,1,0,1,4,0,true
8,float,float2,float4,243,243,243,32,64,52,8,16,32,4,4,5,1,0,1,4,0,true
8,float,float2,float4,244,244,244,32,64,52,8,16,32,4,4,5,1,0,1,4,0,true
8,float,float2,float4,245,245,245,32,64,52,8,16,32,4,4,5,1,0,1,4,0,true
8,float,float2,float4,246,246,246,32,64,52,8,16,32,4,4,5,1,0,1,4,0,true
8,float,float2,float4,247,247,247,32,64,52,8,16,32,4,4,5,1,0,1,4,0,true
8,float,float2,float4,248,248,248,32,64,52,8,16,32,4,4,5,1,0,1,4,0,true
8,float,float2,float4,249,249,249,32,64,52,8,16,32,4,4,5,1,0,1,4,0,true
8,float,float2,float4,250,250,250,32,64,52,8,16,32,4,4,5,1,0,1,4,0,true
8,float,float2,float4,251,251,251,32,64,52,8,16,32,4,4,5,1,0,1,4,0,true
8,float,float2,float4,252,252,252,32,64,52,8,16,32,4,4,5,1,0,1,4,0,true
8,float,float2,float4,253,253,253,32,64,52,8,16,32,4,4,5,1,0,1,4,0,true
8,float,float2,float4,254,254,254,32,64,52,8,16,32,4,4,5,1,0,1,4,0,true
8,float,float2,float4,255,255,255,32,64,52,8,16,32,4,4,5,1,0,1,4,0,true
8,float,float2,float4,256,256,256,32,64,52,8,16,32,4,4,5,1,0,1,4,0,true
8,float,float2,float4,257,257,257,32,64,52,8,16,32,4,4,5,1,0,1,4,0,true
8,float,float2,float4,258,258,258,32,64,52,8,16,32,4,4,5,1,0,1,4,0,true
8,float,float2,float4,259,259,259,32,64,52,8,16,32,4,4,5,1,0,1,4,0,true
8,float,float2,float4,260,260,260,32,64,52,8,16,32,4,4,5,1,0,1,4,0,true
12,float,float2,float4,261,261,261,32,32,88,8,16,32,4,4,3,1,0,1,4,0,true
12,float,float2,float4,262,262,262,32,32,88,8,16,32,4,4,3,1,0,1,4,0,true
5,float,float2,float4,263,263,263,32,32,132,8,8,16,2,2,2,1,0,1,4,0,true
5,float,float2,float4,264,264,264,32,32,132,8,8,16,2,2,2,1,0,1,4,0,true
5,float,float2,float4,265,265,265,32,32,136,8,8,16,2,2,2,1,0,1,4,0,true
5,float,float2,float4,266,266,266,32,32,136,8,8,16,2,2,2,1,0,1,4,0,true
5,float,float2,float4,267,267,267,32,32,136,8,8,16,2,2,2,1,0,1,4,0,true
5,float,float2,float4,268,268,268,32,32,136,8,8,16,2,2,2,1,0,1,4,0,true
8,float,float2,float4,269,269,269,32,64,68,8,16,32,4,4,4,1,0,1,4,0,true
8,float,float2,float4,270,270,270,32,64,68,8,16,32,4,4,4,1,0,1,4,0,true
8,float,float2,float4,271,271,271,32,64,68,8,16,32,4,4,4,1,0,1,4,0,true
8,float,float2,float4,272,272,272,32,64,68,8,16,32,4,4,4,1,0,1,4,0,true
8,float,float2,float4,273,273,273,32,64,72,8,16,32,4,4,4,1,0,1,4,0,true
8,float,float2,float4,274,274,274,32,64,72,8,16,32,4,4,4,1,0,1,4,0,true
8,float,float2,float4,275,275,275,32,64,72,8,16,32,4,4,4,1,0,1,4,0,true
8,float,float2,float4,276,276,276,32,64,72,8,16,32,4,4,4,1,0,1,4,0,true
8,float,float2,float4,277,277,277,32,64,72,8,16,32,4,4,4,1,0,1,4,0,true
8,float,float2,float4,278,278,278,32,64,72,8,16,32,4,4,4,1,0,1,4,0,true
8,float,float2,float4,279,279,279,32,64,72,8,16,32,4,4,4,1,0,1,4,0,true
8,float,float2,float4,280,280,280,32,64,72,8,16,32,4,4,4,1,0,1,4,0,true
8,float,float2,float4,281,281,281,32,64,72,8,16,32,4,4,4,1,0,1,4,0,true
8,float,float2,float4,282,282,282,32,64,72,8,16,32,4,4,4,1,0,1,4,0,true
8,float,float2,float4,283,283,283,32,64,72,8,16,32,4,4,4,1,0,1,4,0,true
8,float,float2,float4,284,284,284,32,64,72,8,16,32,4,4,4,1,0,1,4,0,true
8,float,float2,float4,285,285,285,32,64,72,8,16,32,4,4,4,1,0,1,4,0,true
8,float,float2,float4,286,286,286,32,64,72,8,16,32,4,4,4,1,0,1,4,0,true
8,float,float2,float4,287,287,287,32,64,72,8,16,32,4,4,4,1,0,1,4,0,true
8,float,float2,float4,288,288,288,32,64,72,8,16,32,4,4,4,1,0,1,4,0,true
4,float,float2,float4,289,289,289,64,64,44,8,16,32,4,4,7,1,0,1,4,0,true
4,float,float2,float4,290,290,290,64,64,44,8,16,32,4,4,7,1,0,1,4,0,true
4,float,float2,float4,291,291,291,64,64,44,8,16,32,4,4,7,1,0,1,4,0,true
4,float,float2,float4,292,292,292,64,64,44,8,16,32,4,4,7,1,0,1,4,0,true
4,float,float2,float4,293,293,293,64,64,44,8,16,32,4,4,7,1,0,1,4,0,true
4,float,float2,float4,294,294,294,64,64,44,8,16,32,4,4,7,1,0,1,4,0,true
4,float,float2,float4,295,295,295,64,64,44,8,16,32,4,4,7,1,0,1,4,0,true
4,float,float2,float4,296,296,296,64,64,44,8,16,32,4,4,7,1,0,1,4,0,true
4,float,float2,float4,297,297,297,64,64,44,8,16,32,4,4,7,1,0,1,4,0,true
4,float,float2,float4,298,298,298,64,64,44,8,16,32,4,4,7,1,0,1,4,0,true
4,float,float2,float4,299,299,299,64,64,44,8,16,32,4,4,7,1,0,1,4,0,true
4,float,float2,float4,300,300,300,64,64,44,8,16,32,4,4,7,1,0,1,4,0,true
4,float,float2,float4,301,301,301,64,64,44,8,16,32,4,4,7,1,0,1,4,0,true
4,float,float2,float4,302,302,302,64,64,44,8,16,32,4,4,7,1,0,1,4,0,true
4,float,float2,float4,303,303,303,64,64,44,8,16,32,4,4,7,1,0,1,4,0,true
4,float,float2,float4,304,304,304,64,64,44,8,16,32,4,4,7,1,0,1,4,0,true
7,float,float2,float4,305,305,305,64,64,44,8,32,64,8,8,7,1,0,1,4,0,true
7,float,float2,float4,306,306,306,64,64,44,8,32,64,8,8,7,1,0,1,4,0,true
7,float,float2,float4,307,307,307,64,64,44,8,32,64,8,8,7,1,0,1,4,0,true
7,float,float2,float4,308,308,308,64,64,44,8,32,64,8,8,7,1,0,1,4,0,true
7,float,float2,float4,309,309,309,64,64,48,8,32,64,8,8,7,1,0,1,4,0,true
7,float,float2,float4,310,310,310,64,64,48,8,32,64,8,8,7,1,0,1,4,0,true
7,float,float2,float4,311,311,311,64,64,48,8,32,64,8,8,7,1,0,1,4,0,true
7,float,float2,float4,312,312,312,64,64,48,8,32,64,8,8,7,1,0,1,4,0,true
7,float,float2,float4,313,313,313,64,64,48,8,32,64,8,8,7,1,0,1,4,0,true
7,float,float2,float4,314,314,314,64,64,48,8,32,64,8,8,7,1,0,1,4,0,true
7,float,float2,float4,315,315,315,64,64,48,8,32,64,8,8,7,1,0,1,4,0,true
7,float,float2,float4,316,316,316,64,64,48,8,32,64,8,8,7,1,0,1,4,0,true
7,float,float2,float4,317,317,317,64,64,48,8,32,64,8,8,7,1,0,1,4,0,true
7,float,float2,float4,318,318,318,64,64,48,8,32,64,8,8,7,1,0,1,4,0,true
7,float,float2,float4,319,319,319,64,64,48,8,32,64,8,8,7,1,0,1,4,0,true
7,float,float2,float4,320,320,320,64,64,48,8,32,64,8,8,7,1,0,1,4,0,true
4,float,float2,float4,321,321,321,64,64,56,8,16,32,4,4,6,1,0,1,4,0,true
4,float,float2,float4,322,322,322,64,64,56,8,16,32,4,4,6,1,0,1,4,0,true
4,float,float2,float4,323,323,323,64,64,56,8,16,32,4,4,6,1,0,1,4,0,true
4,float,float2,float4,324,324,324,64,64,56,8,16,32,4,4,6,1,0,1,4,0,true
4,float,float2,float4,325,325,325,64,64,56,8,16,32,4,4,6,1,0,1,4,0,true
4,float,float2,float4,326,326,326,64,64,56,8,16,32,4,4,6,1,0,1,4,0,true
4,float,float2,float4,327,327,327,64,64,56,8,16,32,4,4,6,1,0,1,4,0,true
4,float,float2,float4,328,328,328,64,64,56,8,16,32,4,4,6,1,0,1,4,0,true
4,float,float2,float4,329,329,329,64,64,68,8,16,32,4,4,5,1,0,1,4,0,true
4,float,float2,float4,330,330,330,64,64,68,8,16,32,4,4,5,1,0,1,4,0,true
4,float,float2,float4,331,331,331,64,64,68,8,16,32,4,4,5,1,0,1,4,0,true
4,float,float2,float4,332,332,332,64,64,68,8,16,32,4,4,5,1,0,1,4,0,true
4,float,float2,float4,333,333,333,64,64,68,8,16,32,4,4,5,1,0,1,4,0,true
4,float,float2,float4,334,334,334,64,64,68,8,16,32,4,4,5,1,0,1,4,0,true
4,float,float2,float4,335,335,335,64,64,68,8,16,32,4,4,5,1,0,1,4,0,true
4,float,float2,float4,336,336,336,64,64,68,8,16,32,4,4,5,1,0,1,4,0,true
4,float,float2,float4,337,337,337,64,64,68,8,16,32,4,4,5,1,0,1,4,0,true
4,float,float2,float4,338,338,338,64,64,68,8,16,32,4,4,5,1,0,1,4,0,true
4,float,float2,float4,339,339,339,64,64,68,8,16,32,4,4,5,1,0,1,4,0,true
4,float,float2,float4,340,340,340,64,64,68,8,16,32,4,4,5,1,0,1,4,0,true
4,float,float2,float4,341,341,341,64,64,72,8,16,32,4,4,5,1,0,1,4,0,true
4,float,float2,float4,342,342,342,64,64,72,8,16,32,4,4,5,1,0,1,4,0,true
4,float,float2,float4,343,343,343,64,64,72,8,16,32,4,4,5,1,0,1,4,0,true
4,float,float2,float4,344,344,344,64,64,72,8,16,32,4,4,5,1,0,1,4,0,true
4,float,float2,float4,345,345,345,64,64,72,8,16,32,4,4,5,1,0,1,4,0,true
4,float,float2,float4,346,346,346,64,64,72,8,16,32,4,4,5,1,0,1,4,0,true
4,float,float2,float4,347,347,347,64,64,72,8,16,32,4,4,5,1,0,1,4,0,true
4,float,float2,float4,348,348,348,64,64,72,8,16,32,4,4,5,1,0,1,4,0,true
4,float,float2,float4,349,349,349,64,64,72,8,16,32,4,4,5,1,0,1,4,0,true
4,float,float2,float4,350,350,350,64,64,72,8,16,32,4,4,5,1,0,1,4,0,true
4,float,float2,float4,351,351,351,64,64,72,8,16,32,4,4,5,1,0,1,4,0,true
4,float,float2,float4,352,352,352,64,64,72,8,16,32,4,4,5,1,0,1,4,0,true
4,float,float2,float4,353,353,353,64,64,72,8,16,32,4,4,5,1,0,1,4,0,true
4,float,float2,float4,354,354,354,64,64,72,8,16,32,4,4,5,1,0,1,4,0,true
4,float,float2,float4,355,355,355,64,64,72,8,16,32,4,4,5,1,0,1,4,0,true
4,float,float2,float4,356,356,356,64,64,72,8,16,32,4,4,5,1,0,1,4,0,true
4,float,float2,float4,357,357,357,64,64,72,8,16,32,4,4,5,1,0,1,4,0,true
4,float,float2,float4,358,358,358,64,64,72,8,16,32,4,4,5,1,0,1,4,0,true
4,float,float2,float4,359,359,359,64,64,72,8,16,32,4,4,5,1,0,1,4,0,true
4,float,float2,float4,360,360,360,64,64,72,8,16,32,4,4,5,1,0,1,4,0,true
7,float,float2,float4,361,361,361,64,64,76,8,32,64,8,8,5,1,0,1,4,0,true
7,float,float2,float4,362,362,362,64,64,76,8,32,64,8,8,5,1,0,1,4,0,true
7,float,float2,float4,363,363,363,64,64,76,8,32,64,8,8,5,1,0,1,4,0,true
7,float,float2,float4,364,364,364,64,64,76,8,32,64,8,8,5,1,0,1,4,0,true
7,float,float2,float4,365,365,365,64,64,76,8,32,64,8,8,5,1,0,1,4,0,true
7,float,float2,float4,366,366,366,64,64,76,8,32,64,8,8,5,1,0,1,4,0,true
7,float,float2,float4,367,367,367,64,64,76,8,32,64,8,8,5,1,0,1,4,0,true
7,float,float2,float4,368,368,368,64,64,76,8,32,64,8,8,5,1,0,1,4,0,true
7,float,float2,float4,369,369,369,64,64,76,8,32,64,8,8,5,1,0,1,4,0,true
7,float,float2,float4,370,370,370,64,64,76,8,32,64,8,8,5,1,0,1,4,0,true
7,float,float2,float4,371,371,371,64,64,76,8,32,64,8,8,5,1,0,1,4,0,true
7,float,float2,float4,372,372,372,64,64,76,8,32,64,8,8,5,1,0,1,4,0,true
7,float,float2,float4,373,373,373,64,64,76,8,32,64,8,8,5,1,0,1,4,0,true
7,float,float2,float4,374,374,374,64,64,76,8,32,64,8,8,5,1,0,1,4,0,true
7,float,float2,float4,375,375,375,64,64,76,8,32,64,8,8,5,1,0,1,4,0,true
7,float,float2,float4,376,376,376,64,64,76,8,32,64,8,8,5,1,0,1,4,0,true
7,float,float2,float4,377,377,377,64,64,76,8,32,64,8,8,5,1,0,1,4,0,true
7,float,float2,float4,378,378,378,64,64,76,8,32,64,8,8,5,1,0,1,4,0,true
7,float,float2,float4,379,379,379,64,64,76,8,32,64,8,8,5,1,0,1,4,0,true
7,float,float2,float4,380,380,380,64,64,76,8,32,64,8,8,5,1,0,1,4,0,true
7,float,float2,float4,381,381,381,64,64,80,8,32,64,8,8,5,1,0,1,4,0,true
7,float,float2,float4,382,382,382,64,64,80,8,32,64,8,8,5,1,0,1,4,0,true
7,float,float2,float4,383,383,383,64,64,80,8,32,64,8,8,5,1,0,1,4,0,true
7,float,float2,float4,384,384,384,64,64,80,8,32,64,8,8,5,1,0,1,4,0,true
7,float,float2,float4,385,385,385,64,64,80,8,32,64,8,8,5,1,0,1,4,0,true
7,float,float2,float4,386,386,386,64,64,80,8,32,64,8,8,5,1,0,1,4,0,true
7,float,float2,float4,387,387,387,64,64,80,8,32,64,8,8,5,1,0,1,4,0,true
7,float,float2,float4,388,388,388,64,64,80,8,32,64,8,8,5,1,0,1,4,0,true
4,float,float2,float4,389,389,389,64,64,100,8,16,32,4,4,4,1,0,1,4,0,true
4,float,float2,float4,390,390,390,64,64,100,8,16,32,4,4,4,1,0,1,4,0,true
4,float,float2,float4,391,391,391,64,64,100,8,16,32,4,4,4,1,0,1,4,0,true
4,float,float2,float4,392,392,392,64,64,100,8,16,32,4,4,4,1,0,1,4,0,true
4,float,float2,float4,393,393,393,64,64,100,8,16,32,4,4,4,1,0,1,4,0,true
4,float,float2,float4,394,394,394,64,64,100,8,16,32,4,4,4,1,0,1,4,0,true
4,float,float2,float4,395,395,395,64,64,100,8,16,32,4,4,4,1,0,1,4,0,true
4,float,float2,float4,396,396,396,64,64,100,8,16,32,4,4,4,1,0,1,4,0,true
4,float,float2,float4,397,397,397,64,64,100,8,16,32,4,4,4,1,0,1,4,0,true
4,float,float2,float4,398,398,398,64,64,100,8,16,32,4,4,4,1,0,1,4,0,true
4,float,float2,float4,399,399,399,64,64,100,8,16,32,4,4,4,1,0,1,4,0,true
4,float,float2,float4,400,400,400,64,64,100,8,16,32,4,4,4,1,0,1,4,0,true
7,float,float2,float4,401,401,401,64,64,104,8,32,64,8,8,4,1,0,1,4,0,true
7,float,float2,float4,402,402,402,64,64,104,8,32,64,8,8,4,1,0,1,4,0,true
7,float,float2,float4,403,403,403,64,64,104,8,32,64,8,8,4,1,0,1,4,0,true
7,float,float2,float4,404,404,404,64,64,104,8,32,64,8,8,4,1,0,1,4,0,true
7,float,float2,float4,405,405,405,64,64,104,8,32,64,8,8,4,1,0,1,4,0,true
7,float,float2,float4,406,406,406,64,64,104,8,32,64,8,8,4,1,0,1,4,0,true
7,float,float2,float4,407,407,407,64,64,104,8,32,64,8,8,4,1,0,1,4,0,true
7,float,float2,float4,408,408,408,64,64,104,8,32,64,8,8,4,1,0,1,4,0,true
7,float,float2,float4,409,409,409,64,64,104,8,32,64,8,8,4,1,0,1,4,0,true
7,float,float2,float4,410,410,410,64,64,104,8,32,64,8,8,4,1,0,1,4,0,true
7,float,float2,float4,411,411,411,64,64,104,8,32,64,8,8,4,1,0,1,4,0,true
7,float,float2,float4,412,412,412,64,64,104,8,32,64,8,8,4,1,0,1,4,0,true
7,float,float2,float4,413,413,413,64,64,104,8,32,64,8,8,4,1,0,1,4,0,true
7,float,float2,float4,414,414,414,64,64,104,8,32,64,8,8,4,1,0,1,4,0,true
7,float,float2,float4,415,415,415,64,64,104,8,32,64,8,8,4,1,0,1,4,0,true
7,float,float2,float4,416,416,416,64,64,104,8,32,64,8,8,4,1,0,1,4,0,true
7,float,float2,float4,417,417,417,64,64,108,8,32,64,8,8,4,1,0,1,4,0,true
7,float,float2,float4,418,418,418,64,64,108,8,32,64,8,8,4,1,0,1,4,0,true
7,float,float2,float4,419,419,419,64,64,108,8,32,64,8,8,4,1,0,1,4,0,true
7,float,float2,float4,420,420,420,64,64,108,8,32,64,8,8,4,1,0,1,4,0,true
7,float,float2,float4,421,421,421,64,64,108,8,32,64,8,8,4,1,0,1,4,0,true
7,float,float2,float4,422,422,422,64,64,108,8,32,64,8,8,4,1,0,1,4,0,true
7,float,float2,float4,423,423,423,64,64,108,8,32,64,8,8,4,1,0,1,4,0,true
7,float,float2,float4,424,424,424,64,64,108,8,32,64,8,8,4,1,0,1,4,0,true
7,float,float2,float4,425,425,425,64,64,108,8,32,64,8,8,4,1,0,1,4,0,true
7,float,float2,float4,426,426,426,64,64,108,8,32,64,8,8,4,1,0,1,4,0,true
7,float,float2,float4,427,427,427,64,64,108,8,32,64,8,8,4,1,0,1,4,0,true
7,float,float2,float4,428,428,428,64,64,108,8,32,64,8,8,4,1,0,1,4,0,true
7,float,float2,float4,429,429,429,64,64,108,8,32,64,8,8,4,1,0,1,4,0,true
7,float,float2,float4,430,430,430,64,64,108,8,32,64,8,8,4,1,0,1,4,0,true
7,float,float2,float4,431,431,431,64,64,108,8,32,64,8,8,4,1,0,1,4,0,true
7,float,float2,float4,432,432,432,64,64,108,8,32,64,8,8,4,1,0,1,4,0,true
7,float,float2,float4,433,433,433,64,64,112,8,32,64,8,8,4,1,0,1,4,0,true
7,float,float2,float4,434,434,434,64,64,112,8,32,64,8,8,4,1,0,1,4,0,true
7,float,float2,float4,435,435,435,64,64,112,8,32,64,8,8,4,1,0,1,4,0,true
7,float,float2,float4,436,436,436,64,64,112,8,32,64,8,8,4,1,0,1,4,0,true
7,float,float2,float4,437,437,437,64,64,112,8,32,64,8,8,4,1,0,1,4,0,true
7,float,float2,float4,438,438,438,64,64,112,8,32,64,8,8,4,1,0,1,4,0,true
7,float,float2,float4,439,439,439,64,64,112,8,32,64,8,8,4,1,0,1,4,0,true
7,float,float2,float4,440,440,440,64,64,112,8,32,64,8,8,4,1,0,1,4,0,true
7,float,float2,float4,441,441,441,64,64,112,8,32,64,8,8,4,1,0,1,4,0,true
7,float,float2,float4,442,442,442,64,64,112,8,32,64,8,8,4,1,0,1,4,0,true
7,float,float2,float4,443,443,443,64,64,112,8,32,64,8,8,4,1,0,1,4,0,true
7,float,float2,float4,444,444,444,64,64,112,8,32,64,8,8,4,1,0,1,4,0,true
7,float,float2,float4,445,445,445,64,64,112,8,32,64,8,8,4,1,0,1,4,0,true
7,float,float2,float4,446,446,446,64,64,112,8,32,64,8,8,4,1,0,1,4,0,true
7,float,float2,float4,447,447,447,64,64,112,8,32,64,8,8,4,1,0,1,4,0,true
7,float,float2,float4,448,448,448,64,64,112,8,32,64,8,8,4,1,0,1,4,0,true
4,float,float2,float4,449,449,449,64,128,76,8,32,64,8,8,6,1,0,1,4,0,true
4,float,float2,float4,450,450,450,64,128,76,8,32,64,8,8,6,1,0,1,4,0,true
4,float,float2,float4,451,451,451,64,128,76,8,32,64,8,8,6,1,0,1,4,0,true
4,float,float2,float4,452,452,452,64,128,76,8,32,64,8,8,6,1,0,1,4,0,true
4,float,float2,float4,453,453,453,64,128,76,8,32,64,8,8,6,1,0,1,4,0,true
4,float,float2,float4,454,454,454,64,128,76,8,32,64,8,8,6,1,0,1,4,0,true
4,float,float2,float4,455,455,455,64,128,76,8,32,64,8,8,6,1,0,1,4,0,true
4,float,float2,float4,456,456,456,64,128,76,8,32,64,8,8,6,1,0,1,4,0,true
4,float,float2,float4,457,457,457,64,128,80,8,32,64,8,8,6,1,0,1,4,0,true
4,float,float2,float4,458,458,458,64,128,80,8,32,64,8,8,6,1,0,1,4,0,true
4,float,float2,float4,459,459,459,64,128,80,8,32,64,8,8,6,1,0,1,4,0,true
4,float,float2,float4,460,460,460,64,128,80,8,32,64,8,8,6,1,0,1,4,0,true
2,float,float2,float4,461,461,461,64,128,96,8,16,32,4,4,5,1,0,1,4,0,true
2,float,float2,float4,462,462,462,64,128,96,8,16,32,4,4,5,1,0,1,4,0,true
2,float,float2,float4,463,463,463,64,128,96,8,16,32,4,4,5,1,0,1,4,0,true
2,float,float2,float4,464,464,464,64,128,96,8,16,32,4,4,5,1,0,1,4,0,true
2,float,float2,float4,465,465,465,64,128,96,8,16,32,4,4,5,1,0,1,4,0,true
2,float,float2,float4,466,466,466,64,128,96,8,16,32,4,4,5,1,0,1,4,0,true
2,float,float2,float4,467,467,467,64,128,96,8,16,32,4,4,5,1,0,1,4,0,true
2,float,float2,float4,468,468,468,64,128,96,8,16,32,4,4,5,1,0,1,4,0,true
2,float,float2,float4,469,469,469,64,128,96,8,16,32,4,4,5,1,0,1,4,0,true
2,float,float2,float4,470,470,470,64,128,96,8,16,32,4,4,5,1,0,1,4,0,true
2,float,float2,float4,471,471,471,64,128,96,8,16,32,4,4,5,1,0,1,4,0,true
2,float,float2,float4,472,472,472,64,128,96,8,16,32,4,4,5,1,0,1,4,0,true
2,float,float2,float4,473,473,473,64,128,96,8,16,32,4,4,5,1,0,1,4,0,true
2,float,float2,float4,474,474,474,64,128,96,8,16,32,4,4,5,1,0,1,4,0,true
2,float,float2,float4,475,475,475,64,128,96,8,16,32,4,4,5,1,0,1,4,0,true
2,float,float2,float4,476,476,476,64,128,96,8,16,32,4,4,5,1,0,1,4,0,true
2,float,float2,float4,477,477,477,64,128,96,8,16,32,4,4,5,1,0,1,4,0,true
2,float,float2,float4,478,478,478,64,128,96,8,16,32,4,4,5,1,0,1,4,0,true
2,float,float2,float4,479,479,479,64,128,96,8,16,32,4,4,5,1,0,1,4,0,true
2,float,float2,float4,480,480,480,64,128,96,8,16,32,4,4,5,1,0,1,4,0,true
4,float,float2,float4,481,481,481,64,128,100,8,32,64,8,8,5,1,0,1,4,0,true
4,float,float2,float4,482,482,482,64,128,100,8,32,64,8,8,5,1,0,1,4,0,true
4,float,float2,float4,483,483,483,64,128,100,8,32,64,8,8,5,1,0,1,4,0,true
4,float,float2,float4,484,484,484,64,128,100,8,32,64,8,8,5,1,0,1,4,0,true
4,float,float2,float4,485,485,485,64,128,100,8,32,64,8,8,5,1,0,1,4,0,true
4,float,float2,float4,486,486,486,64,128,100,8,32,64,8,8,5,1,0,1,4,0,true
4,float,float2,float4,487,487,487,64,128,100,8,32,64,8,8,5,1,0,1,4,0,true
4,float,float2,float4,488,488,488,64,128,100,8,32,64,8,8,5,1,0,1,4,0,true
4,float,float2,float4,489,489,489,64,128,100,8,32,64,8,8,5,1,0,1,4,0,true
4,float,float2,float4,490,490,490,64,128,100,8,32,64,8,8,5,1,0,1,4,0,true
4,float,float2,float4,491,491,491,64,128,100,8,32,64,8,8,5,1,0,1,4,0,true
4,float,float2,float4,492,492,492,64,128,100,8,32,64,8,8,5,1,0,1,4,0,true
4,float,float2,float4,493,493,493,64,128,100,8,32,64,8,8,5,1,0,1,4,0,true
4,float,float2,float4,494,494,494,64,128,100,8,32,64,8,8,5,1,0,1,4,0,true
4,float,float2,float4,495,495,495,64,128,100,8,32,64,8,8,5,1,0,1,4,0,true
4,float,float2,float4,496,496,496,64,128,100,8,32,64,8,8,5,1,0,1,4,0,true
4,float,float2,float4,497,497,497,64,128,100,8,32,64,8,8,5,1,0,1,4,0,true
4,float,float2,float4,498,498,498,64,128,100,8,32,64,8,8,5,1,0,1,4,0,true
4,float,float2,float4,499,499,499,64,128,100,8,32,64,8,8,5,1,0,1,4,0,true
4,float,float2,float4,500,500,500,64,128,100,8,32,64,8,8,5,1,0,1,4,0,true
4,float,float2,float4,501,501,501,64,128,104,8,32,64,8,8,5,1,0,1,4,0,true
4,float,float2,float4,502,502,502,64,128,104,8,32,64,8,8,5,1,0,1,4,0,true
4,float,float2,float4,503,503,503,64,128,104,8,32,64,8,8,5,1,0,1,4,0,true
4,float,float2,float4,504,504,504,64,128,104,8,32,64,8,8,5,1,0,1,4,0,true
4,float,float2,float4,505,505,505,64,128,104,8,32,64,8,8,5,1,0,1,4,0,true
4,float,float2,float4,506,506,506,64,128,104,8,32,64,8,8,5,1,0,1,4,0,true
4,float,float2,float4,507,507,507,64,128,104,8,32,64,8,8,5,1,0,1,4,0,true
4,float,float2,float4,508,508,508,64,128,104,8,32,64,8,8,5,1,0,1,4,0,true
4,float,float2,float4,509,509,509,64,128,104,8,32,64,8,8,5,1,0,1,4,0,true
4,float,float2,float4,510,510,510,64,128,104,8,32,64,8,8,5,1,0,1,4,0,true
4,float,float2,float4,511,511,511,64,128,104,8,32,64,8,8,5,1,0,1,4,0,true
4,float,float2,float4,512,512,512,64,128,104,8,32,64,8,8,5,1,0,1,4,0,true
